komentar,clean,normal
"Nih 𝙋𝙐𝙇𝘼𝙐𝙒𝙄𝙉 apaan sih, kenapa kayak semua orang tau tapi gue doang yang kudet 😭",nih apaan sih kenapa kayak semua orang tau tapi gue doang yang kudet,nih apaan sih kenapa kayak semua orang tau tapi gue doang yang kudet
Lo juga sering liat gak sih tulisan ρυℓαυωιɴ di komenan random?,lo juga sering liat gak sih tulisan di komenan random,lo juga sering liat gak sih tulisan di komenan random
"Nih 𝙋𝙐𝙇𝘼𝙐𝙒𝙄𝙉 tiap buka TikTok pasti nongol lagi, apaan sih sebenernya 😭",nih tiap buka tiktok pasti nongol lagi apaan sih sebenernya,nih tiap buka tiktok pasti nongol lagi apaan sih sebenernya
"SEMANGAT GARUDA KU❤❤, KESEMPATAN DIDEPAN MATA 🇮🇩🇮🇩🇮🇩🇮🇩",semangat garuda ku kesempatan didepan mata,semangat garuda ku kesempatan didepan mata
Takut Dijahilin Wasit ❌<br><br>Takut Lihat Line-Up  ✅,takut dijahilin wasit brbrtakut lihat lineup,takut dijahilin wasit brbrtakut lihat lineup
Sudahlah.,sudahlah,sudahlah
coach patrick jgn macem macem yya line upnya,coach patrick jgn macem macem yya line upnya,coach patrick jgn macem macem yya line upnya
Do&#39;a terbaik buat timnas,doa terbaik buat timnas,doa terbaik buat timnas
🙏 full diaspora lawan irak,full diaspora lawan irak,full diaspora lawan irak
Hadir 3 Menit,hadir menit,hadir menit
proses!<br>piala asia nanti kita pasti matang!,prosesbrpiala asia nanti kita pasti matang,prosesbrpiala asia nanti kita pasti matang
Kalau pun menang nasib masih di tentukan sama irak dan arab saudi yg akan bermain terakhir dan itu klo seri pertandingan mereka kita juga nggak bakal lolos 😢,kalau pun menang nasib masih di tentukan sama irak dan arab saudi yg akan bermain terakhir dan itu klo seri pertandingan mereka kita juga nggak bakal lolos,kalau pun menang nasib masih di tentukan sama irak dan arab saudi yang akan bermain terakhir dan itu klo seri pertandingan mereka kita juga tidak bakal lolos
"Jangan dongo ya startingnya malam ini, kalau sampe lokal pret si Klok, Beckham, yakob fix emang tim kepelatihan ini gabisa baca situasi Dan memahami attribute setiap pemain. Intinya dongo dah",jangan dongo ya startingnya malam ini kalau sampe lokal pret si klok beckham yakob fix emang tim kepelatihan ini gabisa baca situasi dan memahami attribute setiap pemain intinya dongo dah,jangan dongo ya startingnya malam ini kalau sampe lokal pret si klok beckham yakob fix emang tim kepelatihan ini gabisa baca situasi dan memahami attribute setiap pemain intinya dongo dah
Bojan hodak cocok latih timnas dengan strategi counter attack 👍🏻,bojan hodak cocok latih timnas dengan strategi counter attack,bojan hodak cocok latih timnas dengan strategi counter attack
Ayo bismillah Garudaku,ayo bismillah garudaku,ayo bismillah garudaku
Petrik tai awas lu turunin len AP bobrok,petrik tai awas lu turunin len ap bobrok,petrik tai awas lu turunin len ap bobrok
Patrick out Alex  head coach,patrick out alex head coach,patrick out alex head coach
gua ga ikhlas kalau misal ga lolos,gua ga ikhlas kalau misal ga lolos,gua tidak ikhlas kalau misal tidak lolos
Hanya bisa ikhlas,hanya bisa ikhlas,hanya bisa ikhlas
Mending jadiin Pastor head coach,mending jadiin pastor head coach,mending jadiin pastor head coach
"Kalau kalah tolong sadar diri, ANGKAT KAKI !!",kalau kalah tolong sadar diri angkat kaki,kalau kalah tolong sadar diri angkat kaki
"Harusnya pakai Jersey away , karna akan bisa bawa kita menang 🎉",harusnya pakai jersey away karna akan bisa bawa kita menang,harusnya pakai jersey away karna akan bisa bawa kita menang
"Patrick ini kesempatan lu, nasib lu ditentuin malam ini",patrick ini kesempatan lu nasib lu ditentuin malam ini,patrick ini kesempatan lu nasib lu ditentuin malam ini
Bismillah... InsyaAllah diberi kemenangan,bismillah insyaallah diberi kemenangan,bismillah insyaallah diberi kemenangan
Menang g ni,menang g ni,menang g ni
